{
  "metadata": {
    "video_id": "scene-0852",
    "dataset": "NuScenes",
    "video_path": "videos/Nuscenes Dataset/generated_videos/part-8/scene-0852.mp4"
  },
  "road_network": {
    "road_type": "urban",
    "road_layout": "straight road",
    "no_of_lanes": 2,
    "intersection_control": "signalized",
    "traffic_sign": [
      "stop"
    ],
    "traffic_light": "red"
  },
  "environmental_conditions": {
    "weather": "overcast",
    "visibility": "Good",
    "lighting": "Daylight"
  },
  "ego_vehicle": {
    "maneuver": "stop"
  },
  "npc_actors": [
    {
      "actor_type": "car",
      "maneuver": "stop"
    }
  ],
  "event_details": {
    "event_description": "The ego vehicle approaches an intersection and stops behind other traffic in response to a red traffic light.",
    "event_class": "Traffic Control",
    "event_pattern": "Co-linear",
    "event_severity": "low"
  }
}
