{
  "metadata": {
    "video_id": "scene-1041",
    "dataset": "NuScenes",
    "video_path": "videos/Nuscenes Dataset/generated_videos/test/scene-1041.mp4"
  },
  "road_network": {
    "road_type": "urban",
    "road_layout": "straight road",
    "no_of_lanes": 2,
    "intersection_control": "unsignalized",
    "traffic_sign": [],
    "traffic_light": "none"
  },
  "environmental_conditions": {
    "weather": "clear",
    "visibility": "Good",
    "lighting": "Night"
  },
  "ego_vehicle": {
    "maneuver": "go straight"
  },
  "npc_actors": [
    {
      "actor_type": "pedestrian",
      "maneuver": "crossing road right to left"
    },
    {
      "actor_type": "bus",
      "maneuver": "stationary"
    }
  ],
  "event_details": {
    "event_description": "Ego vehicle slows down and yields to a pedestrian crossing the road at a marked crosswalk at night.",
    "event_class": "Animal and Pedestrian",
    "event_pattern": "Cross-linear",
    "event_severity": "medium"
  }
}
