{
  "metadata": {
    "video_id": "scene-0071",
    "dataset": "NuScenes",
    "video_path": "videos/Nuscenes Dataset/generated_videos/part-1/scene-0071.mp4"
  },
  "road_network": {
    "road_type": "semi-urban",
    "road_layout": "straight road",
    "no_of_lanes": 1,
    "intersection_control": "none",
    "traffic_sign": [
      "road closed"
    ],
    "traffic_light": "none"
  },
  "environmental_conditions": {
    "weather": "overcast",
    "visibility": "Good",
    "lighting": "Daylight"
  },
  "ego_vehicle": {
    "maneuver": "stop"
  },
  "npc_actors": [
    {
      "actor_type": "truck",
      "maneuver": "stationary"
    },
    {
      "actor_type": "car",
      "maneuver": "stationary"
    },
    {
      "actor_type": "pedestrian",
      "maneuver": "crossing road right to left"
    }
  ],
  "event_details": {
    "event_description": "The ego vehicle approaches a road closure blockaded by construction equipment (wheel loader) and road closed signage, requiring it to stop.",
    "event_class": "Obstacle Detection",
    "event_pattern": "Co-linear",
    "event_severity": "medium"
  }
}
