{
  "metadata": {
    "video_id": "scene-0045",
    "dataset": "NuScenes",
    "video_path": "videos/Nuscenes Dataset/generated_videos/part-1/scene-0045.mp4"
  },
  "road_network": {
    "road_type": "urban",
    "road_layout": "straight road",
    "no_of_lanes": 2,
    "intersection_control": "unsignalized",
    "traffic_sign": [
      "stop"
    ],
    "traffic_light": "none"
  },
  "environmental_conditions": {
    "weather": "clear",
    "visibility": "Good",
    "lighting": "Daylight"
  },
  "ego_vehicle": {
    "maneuver": "go straight"
  },
  "npc_actors": [
    {
      "actor_type": "car",
      "maneuver": "stop"
    },
    {
      "actor_type": "truck",
      "maneuver": "stop"
    },
    {
      "actor_type": "motorbike",
      "maneuver": "stop"
    }
  ],
  "event_details": {
    "event_description": "The ego vehicle approaches and passes through a carpark exit gantry barrier obstacle, proceeding straight out onto a road.",
    "event_class": "Obstacle Detection",
    "event_pattern": "Co-linear",
    "event_severity": "low"
  }
}
