{
  "metadata": {
    "video_id": "scene-0971",
    "dataset": "NuScenes",
    "video_path": "videos/Nuscenes Dataset/generated_videos/part-9/scene-0971.mp4"
  },
  "road_network": {
    "road_type": "semi-urban",
    "road_layout": "straight road",
    "no_of_lanes": 2,
    "intersection_control": "none",
    "traffic_sign": [],
    "traffic_light": "none"
  },
  "environmental_conditions": {
    "weather": "clear",
    "visibility": "Good",
    "lighting": "Daylight"
  },
  "ego_vehicle": {
    "maneuver": "go straight"
  },
  "npc_actors": [
    {
      "actor_type": "car",
      "maneuver": "stationary"
    },
    {
      "actor_type": "pedestrian",
      "maneuver": "crossing road left to right"
    }
  ],
  "event_details": {
    "event_description": "The ego vehicle drives straight on a semi-urban road while a pedestrian crosses the road ahead from left to right near an entrance gate.",
    "event_class": "Animal and Pedestrian",
    "event_pattern": "Cross-linear",
    "event_severity": "low"
  }
}
