{
  "metadata": {
    "video_id": "scene-0285",
    "dataset": "NuScenes",
    "video_path": "videos/Nuscenes Dataset/generated_videos/part-3/scene-0285.mp4"
  },
  "road_network": {
    "road_type": "urban",
    "road_layout": "curved road",
    "no_of_lanes": 2,
    "intersection_control": "none",
    "traffic_sign": [],
    "traffic_light": "none"
  },
  "environmental_conditions": {
    "weather": "clear",
    "visibility": "Good",
    "lighting": "Daylight"
  },
  "ego_vehicle": {
    "maneuver": "go straight"
  },
  "npc_actors": [
    {
      "actor_type": "car",
      "maneuver": "go straight"
    },
    {
      "actor_type": "pedestrian",
      "maneuver": "stationary"
    }
  ],
  "event_details": {
    "event_description": "The ego vehicle drives through an urban construction zone area bordered by concrete barriers and construction fencing.",
    "event_class": "Obstacle Detection",
    "event_pattern": "Co-linear",
    "event_severity": "low"
  }
}
