{
  "metadata": {
    "video_id": "scene-0929",
    "dataset": "NuScenes",
    "video_path": "videos/Nuscenes Dataset/generated_videos/part-9/scene-0929.mp4"
  },
  "road_network": {
    "road_type": "urban",
    "road_layout": "curved road",
    "no_of_lanes": 2,
    "intersection_control": "unsignalized",
    "traffic_sign": [
      "no entry",
      "stop"
    ],
    "traffic_light": "none"
  },
  "environmental_conditions": {
    "weather": "overcast",
    "visibility": "Good",
    "lighting": "Daylight"
  },
  "ego_vehicle": {
    "maneuver": "go straight"
  },
  "npc_actors": [
    {
      "actor_type": "pedestrian",
      "maneuver": "crossing road left to right"
    }
  ],
  "event_details": {
    "event_description": "The ego vehicle approaches and passes through a parking barrier gate, continuing along a curved urban campus road.",
    "event_class": "Obstacle Detection",
    "event_pattern": "Co-linear",
    "event_severity": "low"
  }
}
