{
  "metadata": {
    "video_id": "scene-0796",
    "dataset": "NuScenes",
    "video_path": "videos/Nuscenes Dataset/generated_videos/part-8/scene-0796.mp4"
  },
  "road_network": {
    "road_type": "urban",
    "road_layout": "intersection",
    "no_of_lanes": 2,
    "intersection_control": "signalized",
    "traffic_sign": [
      "caution",
      "school zone",
      "speed limit"
    ],
    "traffic_light": "green"
  },
  "environmental_conditions": {
    "weather": "clear",
    "visibility": "Good",
    "lighting": "Daylight"
  },
  "ego_vehicle": {
    "maneuver": "go straight"
  },
  "npc_actors": [
    {
      "actor_type": "car",
      "maneuver": "go straight"
    },
    {
      "actor_type": "pedestrian",
      "maneuver": "stationary"
    }
  ],
  "event_details": {
    "event_description": "Ego vehicle proceeds straight through a signalized urban intersection observing school zone signs and following traffic flow under clear daylight conditions.",
    "event_class": "Traffic Control",
    "event_pattern": "Co-linear",
    "event_severity": "low"
  }
}
