{
  "metadata": {
    "video_id": "scene-0087",
    "dataset": "NuScenes",
    "video_path": "videos/Nuscenes Dataset/generated_videos/test/scene-0087.mp4"
  },
  "road_network": {
    "road_type": "urban",
    "road_layout": "intersection",
    "no_of_lanes": 2,
    "intersection_control": "unsignalized",
    "traffic_sign": [
      "stop"
    ],
    "traffic_light": "none"
  },
  "environmental_conditions": {
    "weather": "overcast",
    "visibility": "Good",
    "lighting": "Daylight"
  },
  "ego_vehicle": {
    "maneuver": "stop"
  },
  "npc_actors": [
    {
      "actor_type": "car",
      "maneuver": "turn left"
    },
    {
      "actor_type": "bus",
      "maneuver": "turn right"
    },
    {
      "actor_type": "car",
      "maneuver": "turn left"
    }
  ],
  "event_details": {
    "event_description": "The ego vehicle approaches an unsignalized intersection with a stop sign and stops to yield right of way to crossing traffic including a bus and other vehicles passing through the intersection.",
    "event_class": "Vehicle Interaction",
    "event_pattern": "Cross-linear",
    "event_severity": "low"
  }
}
