{
  "metadata": {
    "video_id": "scene-0831",
    "dataset": "NuScenes",
    "video_path": "videos/Nuscenes Dataset/generated_videos/test/scene-0831.mp4"
  },
  "road_network": {
    "road_type": "semi-urban",
    "road_layout": "curved road",
    "no_of_lanes": 2,
    "intersection_control": "none",
    "traffic_sign": [
      "slow"
    ],
    "traffic_light": "none"
  },
  "environmental_conditions": {
    "weather": "clear",
    "visibility": "Good",
    "lighting": "Daylight"
  },
  "ego_vehicle": {
    "maneuver": "go straight"
  },
  "npc_actors": [
    {
      "actor_type": "pedestrian",
      "maneuver": "crossing road left to right"
    }
  ],
  "event_details": {
    "event_description": "Ego vehicle navigates a campus roadway while a pedestrian crosses near the roadside.",
    "event_class": "Animal and Pedestrian",
    "event_pattern": "Cross-linear",
    "event_severity": "low"
  }
}
