{
  "metadata": {
    "video_id": "scene-0100",
    "dataset": "NuScenes",
    "video_path": "videos/Nuscenes Dataset/generated_videos/part-1/scene-0100.mp4"
  },
  "road_network": {
    "road_type": "urban",
    "road_layout": "intersection",
    "no_of_lanes": 2,
    "intersection_control": "signalized",
    "traffic_sign": [],
    "traffic_light": "red"
  },
  "environmental_conditions": {
    "weather": "clear",
    "visibility": "Good",
    "lighting": "Daylight"
  },
  "ego_vehicle": {
    "maneuver": "stop"
  },
  "npc_actors": [
    {
      "actor_type": "car",
      "maneuver": "stationary"
    },
    {
      "actor_type": "truck",
      "maneuver": "stationary"
    },
    {
      "actor_type": "bicycle",
      "maneuver": "go straight"
    }
  ],
  "event_details": {
    "event_description": "The ego vehicle is stopped at an urban intersection behind other vehicles waiting for the traffic light to change.",
    "event_class": "Traffic Control",
    "event_pattern": "Co-linear",
    "event_severity": "low"
  }
}
