{
  "metadata": {
    "video_id": "scene-1059",
    "dataset": "NuScenes",
    "video_path": "videos/Nuscenes Dataset/generated_videos/part-10/scene-1059.mp4"
  },
  "road_network": {
    "road_type": "urban",
    "road_layout": "curved road",
    "no_of_lanes": 2,
    "intersection_control": "none",
    "traffic_sign": [
      "speed limit"
    ],
    "traffic_light": "none"
  },
  "environmental_conditions": {
    "weather": "rain",
    "visibility": "Moderate",
    "lighting": "Night"
  },
  "ego_vehicle": {
    "maneuver": "follow"
  },
  "npc_actors": [
    {
      "actor_type": "car",
      "maneuver": "stationary"
    }
  ],
  "event_details": {
    "event_description": "The ego vehicle drives along a wet, curved urban road at night, following a parked car on the side of the road and passing a slow sign.",
    "event_class": "Obstacle Detection",
    "event_pattern": "Co-linear",
    "event_severity": "low"
  }
}
