{
  "metadata": {
    "video_id": "scene-0006",
    "dataset": "NuScenes",
    "video_path": "videos/Nuscenes Dataset/generated_videos/part-1/scene-0006.mp4"
  },
  "road_network": {
    "road_type": "urban",
    "road_layout": "curved road",
    "no_of_lanes": 2,
    "intersection_control": "none",
    "traffic_sign": [],
    "traffic_light": "none"
  },
  "environmental_conditions": {
    "weather": "overcast",
    "visibility": "Good",
    "lighting": "Daylight"
  },
  "ego_vehicle": {
    "maneuver": "go straight"
  },
  "npc_actors": [
    {
      "actor_type": "pedestrian",
      "maneuver": "crossing road left to right"
    },
    {
      "actor_type": "truck",
      "maneuver": "stationary"
    }
  ],
  "event_details": {
    "event_description": "Ego vehicle navigates an urban road past parked and stationary utility vehicles alongside pedestrians crossing the street.",
    "event_class": "Obstacle Detection",
    "event_pattern": "Cross-linear",
    "event_severity": "low"
  }
}
