{
  "metadata": {
    "video_id": "scene-0414",
    "dataset": "NuScenes",
    "video_path": "videos/Nuscenes Dataset/generated_videos/part-4/scene-0414.mp4"
  },
  "road_network": {
    "road_type": "urban",
    "road_layout": "curved road",
    "no_of_lanes": 2,
    "intersection_control": "none",
    "traffic_sign": [
      "speed limit",
      "slow"
    ],
    "traffic_light": "none"
  },
  "environmental_conditions": {
    "weather": "clear",
    "visibility": "Good",
    "lighting": "Daylight"
  },
  "ego_vehicle": {
    "maneuver": "follow"
  },
  "npc_actors": [
    {
      "actor_type": "car",
      "maneuver": "follow"
    }
  ],
  "event_details": {
    "event_description": "The ego vehicle follows a white van along a curved residential urban road during daylight.",
    "event_class": "Vehicle Interaction",
    "event_pattern": "Co-linear",
    "event_severity": "low"
  }
}
