{
  "metadata": {
    "video_id": "scene-0275",
    "dataset": "NuScenes",
    "video_path": "videos/Nuscenes Dataset/generated_videos/part-3/scene-0275.mp4"
  },
  "road_network": {
    "road_type": "urban",
    "road_layout": "intersection",
    "no_of_lanes": 2,
    "intersection_control": "signalized",
    "traffic_sign": [],
    "traffic_light": "red"
  },
  "environmental_conditions": {
    "weather": "overcast",
    "visibility": "Good",
    "lighting": "Daylight"
  },
  "ego_vehicle": {
    "maneuver": "stop"
  },
  "npc_actors": [
    {
      "actor_type": "bus",
      "maneuver": "go straight"
    },
    {
      "actor_type": "car",
      "maneuver": "stationary"
    },
    {
      "actor_type": "pedestrian",
      "maneuver": "stationary"
    }
  ],
  "event_details": {
    "event_description": "Ego vehicle approaches a signalized intersection and comes to a stop behind other vehicles due to a red traffic light.",
    "event_class": "Traffic Control",
    "event_pattern": "Co-linear",
    "event_severity": "low"
  }
}
