{
  "metadata": {
    "video_id": "scene-0542",
    "dataset": "NuScenes",
    "video_path": "videos/Nuscenes Dataset/generated_videos/part-6/scene-0542.mp4"
  },
  "road_network": {
    "road_type": "urban",
    "road_layout": "intersection",
    "no_of_lanes": 2,
    "intersection_control": "signalized",
    "traffic_sign": [],
    "traffic_light": "red"
  },
  "environmental_conditions": {
    "weather": "overcast",
    "visibility": "Good",
    "lighting": "Daylight"
  },
  "ego_vehicle": {
    "maneuver": "stop"
  },
  "npc_actors": [
    {
      "actor_type": "car",
      "maneuver": "crossing road right to left"
    }
  ],
  "event_details": {
    "event_description": "The ego vehicle is stopped at a signalized intersection while cross traffic passes through.",
    "event_class": "Traffic Control",
    "event_pattern": "Cross-linear",
    "event_severity": "low"
  }
}
