{
  "metadata": {
    "video_id": "scene-0943",
    "dataset": "NuScenes",
    "video_path": "videos/Nuscenes Dataset/generated_videos/test/scene-0943.mp4"
  },
  "road_network": {
    "road_type": "urban",
    "road_layout": "straight road",
    "no_of_lanes": 2,
    "intersection_control": "none",
    "traffic_sign": [],
    "traffic_light": "none"
  },
  "environmental_conditions": {
    "weather": "clear",
    "visibility": "Good",
    "lighting": "Daylight"
  },
  "ego_vehicle": {
    "maneuver": "follow"
  },
  "npc_actors": [
    {
      "actor_type": "truck",
      "maneuver": "follow"
    }
  ],
  "event_details": {
    "event_description": "Ego vehicle follows a delivery truck closely on a straight urban road.",
    "event_class": "Vehicle Interaction",
    "event_pattern": "Co-linear",
    "event_severity": "low"
  }
}
