{
  "metadata": {
    "video_id": "scene-0700",
    "dataset": "NuScenes",
    "video_path": "videos/Nuscenes Dataset/generated_videos/part-7/scene-0700.mp4"
  },
  "road_network": {
    "road_type": "urban",
    "road_layout": "intersection",
    "no_of_lanes": 2,
    "intersection_control": "signalized",
    "traffic_sign": [],
    "traffic_light": "green"
  },
  "environmental_conditions": {
    "weather": "clear",
    "visibility": "Good",
    "lighting": "Daylight"
  },
  "ego_vehicle": {
    "maneuver": "go straight"
  },
  "npc_actors": [
    {
      "actor_type": "car",
      "maneuver": "turn right"
    }
  ],
  "event_details": {
    "event_description": "Ego vehicle proceeds straight through a signalized intersection on a green light.",
    "event_class": "Traffic Control",
    "event_pattern": "Cross-linear",
    "event_severity": "low"
  }
}
