{
  "metadata": {
    "video_id": "scene-0853",
    "dataset": "NuScenes",
    "video_path": "videos/Nuscenes Dataset/generated_videos/part-8/scene-0853.mp4"
  },
  "road_network": {
    "road_type": "urban",
    "road_layout": "intersection",
    "no_of_lanes": 2,
    "intersection_control": "signalized",
    "traffic_sign": [
      "yield"
    ],
    "traffic_light": "red"
  },
  "environmental_conditions": {
    "weather": "overcast",
    "visibility": "Good",
    "lighting": "Daylight"
  },
  "ego_vehicle": {
    "maneuver": "turn left"
  },
  "npc_actors": [
    {
      "actor_type": "car",
      "maneuver": "turn left"
    },
    {
      "actor_type": "car",
      "maneuver": "stop"
    },
    {
      "actor_type": "bus",
      "maneuver": "follow"
    }
  ],
  "event_details": {
    "event_description": "The ego vehicle approaches a signalized intersection from a minor road, waits at the red traffic light/yield sign, and then performs a left turn onto a multi-lane urban road, following other traffic.",
    "event_class": "Traffic Control",
    "event_pattern": "Cross-linear",
    "event_severity": "low"
  }
}
