{
  "metadata": {
    "video_id": "scene-0379",
    "dataset": "NuScenes",
    "video_path": "videos/Nuscenes Dataset/generated_videos/part-4/scene-0379.mp4"
  },
  "road_network": {
    "road_type": "urban",
    "road_layout": "curved road",
    "no_of_lanes": 2,
    "intersection_control": "none",
    "traffic_sign": [],
    "traffic_light": "none"
  },
  "environmental_conditions": {
    "weather": "clear",
    "visibility": "Good",
    "lighting": "Daylight"
  },
  "ego_vehicle": {
    "maneuver": "go straight"
  },
  "npc_actors": [
    {
      "actor_type": "pedestrian",
      "maneuver": "crossing road right to left"
    },
    {
      "actor_type": "car",
      "maneuver": "stationary"
    }
  ],
  "event_details": {
    "event_description": "The ego vehicle drives straight along an urban road passing a pedestrian crossing and a small utility vehicle ahead.",
    "event_class": "Animal and Pedestrian",
    "event_pattern": "Cross-linear",
    "event_severity": "low"
  }
}
