{
  "metadata": {
    "video_id": "scene-0872",
    "dataset": "NuScenes",
    "video_path": "videos/Nuscenes Dataset/generated_videos/part-8/scene-0872.mp4"
  },
  "road_network": {
    "road_type": "urban",
    "road_layout": "intersection",
    "no_of_lanes": 2,
    "intersection_control": "signalized",
    "traffic_sign": [],
    "traffic_light": "green"
  },
  "environmental_conditions": {
    "weather": "rain",
    "visibility": "Moderate",
    "lighting": "Daylight"
  },
  "ego_vehicle": {
    "maneuver": "go straight"
  },
  "npc_actors": [
    {
      "actor_type": "truck",
      "maneuver": "turn left"
    },
    {
      "actor_type": "car",
      "maneuver": "turn left"
    },
    {
      "actor_type": "car",
      "maneuver": "follow"
    }
  ],
  "event_details": {
    "event_description": "The ego vehicle proceeds straight through a signalized urban intersection under rainy weather conditions while interacting with surrounding traffic.",
    "event_class": "Traffic Control",
    "event_pattern": "Co-linear",
    "event_severity": "low"
  }
}
