{
  "metadata": {
    "video_id": "scene-1082",
    "dataset": "NuScenes",
    "video_path": "videos/Nuscenes Dataset/generated_videos/part-10/scene-1082.mp4"
  },
  "road_network": {
    "road_type": "urban",
    "road_layout": "curved road",
    "no_of_lanes": 2,
    "intersection_control": "none",
    "traffic_sign": [],
    "traffic_light": "none"
  },
  "environmental_conditions": {
    "weather": "clear",
    "visibility": "Good",
    "lighting": "Night"
  },
  "ego_vehicle": {
    "maneuver": "follow"
  },
  "npc_actors": [
    {
      "actor_type": "car",
      "maneuver": "follow"
    }
  ],
  "event_details": {
    "event_description": "The ego vehicle follows a lead car smoothly along a curved urban road at night.",
    "event_class": "Vehicle Interaction",
    "event_pattern": "Co-linear",
    "event_severity": "low"
  }
}
